Title,Citation
"Hope for the best, prepare for the worst: multi-tier control for adaptive systems",40
How Developers' Experience and Ability Influence Web Application Comprehension Tasks Supported by UML Stereotypes: A Series of Four Experiments,79
How Effectively Does Metamorphic Testing Alleviate the Oracle Problem?,94
How Far We Have Progressed in the Journey? An Examination of Cross-Project Defect Prediction,13
"How Programmers Debug, Revisited: An Information Foraging Theory Perspective",119
How Reliable Are Systematic Reviews in Empirical Software Engineering?,83
How Social and Communication Channels Shape and Challenge a Participatory Culture in Software Development,59
How Software Designers Interact with Sketches at the Whiteboard,21
How Software Developers Use Tagging to Support Reminding and Refinding,63
"How We Refactor, and How We Know It",493
How Well Do Search Engines Support Code Retrieval on the Web?,54
How can I use this method?,65
How developers search for code: a case study,64
How did you specify your test suite,32
How do API documentation and static typing affect API usability?,50
How do centralized and distributed version control systems impact software changes?,77
How do developers fix cross-project correlated bugs?: a case study on the GitHub scientific python ecosystem,25
How do professional developers comprehend software?,147
How do professionals perceive legacy systems and software modernization?,40
How does regression test prioritization perform in real-world software evolution?,39
How does the degree of variability affect bug finding?,41
How good are the specs? a study of the bug-finding effectiveness of existing Java API specifications,14
How good is a security policy against real breaches?: a HIPAA case study,9
How many of all bugs do we find? a study of static bug detectors,7
How modern news aggregators help development communities shape and share knowledge,12
How much up-front?: a grounded theory of agile architecture,25
How not to structure your database-backed web applications: a study of performance bugs in the wild,8
How practitioners perceive the relevance of software engineering research,64
How should compilers explain problems to developers?,2
How tagging helps bridge the gap between social and technical aspects in software development,81
How to avoid drastic software process change (using stochastic stability),28
How to effectively use topic models for software engineering tasks? an approach based on genetic algorithms,205
How to make best use of cross-company data in software effort estimation?,41
How well are regular expressions tested in the wild?,5
"How, and why, process metrics are better",176
Human Competitiveness of Genetic Programming in Spectrum-Based Fault Localisation: Theoretical and Empirical Analysis,11
Human performance regression testing,13
HybriDroid: static analysis framework for Android hybrid applications,29
Hybrid Program Dependence Approximation for Effective Dynamic Impact Prediction,1
Hybrid regression test selection,19
IccTA: detecting inter-component privacy leaks in Android apps,350
Identification of Move Method Refactoring Opportunities,256
"Identification, Impact, and Refactoring of Smells in Pipe-Like Web Mashups",19
Identifying Code of Individual Features in Client-Side Web Applications,28
Identifying Extract Method Refactoring Opportunities Based on Functional Relevance,11
Identifying Linux bug fixing patches,90
Identifying Renaming Opportunities by Expanding Conducted Rename Refactorings,8
Identifying and Summarizing Systematic Code Changes via Rule Inference,53
Identifying and quantifying architectural debt,39
Identifying crosscutting concerns using historical code changes,54
Identifying design problems in the source code: a grounded theory,5
Identifying domain elements from textual specifications,7
Identifying execution points for dynamic analyses,3
Identifying features in forks,4
Identifying future field accesses in exhaustive state space traversal,15
Identifying impactful service system problems via log analysis,2
Identifying message flow in distributed event-based systems,29
Identifying patch correctness in test-based program repair,25
Impact of Budget and Schedule Pressure on Software Development Cycle Time and Effort,95
Impact of developer turnover on quality in open-source software,37
Impact-Driven Process Model Repair,32
Implementing and Evaluating Candidate-Based Invariant Generation,3
Imprecise Matching of Requirements Specifications for Software Services Using Fuzzy Logic,7
Improved Evolutionary Algorithm Design for the Project Scheduling Problem Based on Runtime Analysis,36
Improved query reformulation for concept location using CodeRank and document structures,6
Improving API documentation usability with knowledge pushing,104
Improving Automated Bug Triaging with Specialized Topic Model,38
Improving IR-based bug localization with context-aware query reformulation,7
Improving Multi-Objective Test Case Selection by Injecting Diversity in Genetic Algorithms,54
Improving Source Code Lexicon via Traceability and Information Retrieval,61
Improving automated documentation to code traceability by combining retrieval techniques,46
Improving automated source code summarization via an eye-tracking study of programmers,97
Improving automatic source code summarization via deep reinforcement learning,7
Improving bug localization using structured information retrieval,178
Improving bug triage with bug tossing graphs,376
Improving early detection of software merge conflicts,93
Improving feature location practice with multi-faceted interactive exploration,39
Improving model-based test generation by model decomposition,2
Improving refactoring speed by 10X,17
Improving slice accuracy by compression of data and control flow paths,10
Improving software modularization via automated analysis of latent topics and dependencies,88
Improving software text retrieval using conceptual knowledge in source code,3
Improving the accuracy of oracle verdicts through automated model steering,5
Improving the effectiveness of spectra-based fault localization using specifications,40
Improving trace accuracy through data-driven configuration and composition of tracing features,61
In-field healing of integration problems with COTS components,33
In-memory fuzzing for binary code similarity analysis,8
IncA: a DSL for the definition of incremental program analyses,24
Incremental Test Generation for Software Product Lines,91
Incrementally synthesizing controllers from scenario-based product line specifications,28
Inductive verification of data model invariants for web applications,16
Inferring Extended Probabilistic Finite-State Automaton Models from Software Executions,2
"Inferring Loop Invariants by Mutation, Dynamic Analysis, and Static Checking",12
Inferring and asserting distributed system invariants,6
Inferring annotations for device drivers from verification histories,7
Inferring class level specifications for distributed systems,24
Inferring hierarchical motifs from execution traces,6
Inferring likely mappings between APIs,41
Inferring method specifications from natural language API descriptions,113
Inferring models of concurrent systems from logs of their behavior with CSight,87
Inferring project-specific bug patterns for detecting sibling bugs,9
Inflow and Retention in OSS Communities with Commercial Involvement: A Case Study of Three Hybrid Projects,23
Influence of social and technical factors for evaluating contribution in GitHub,198
Information flows as a permission mechanism,43
Information retrieval and spectrum based bug localization: better together,63
Inheritance usage patterns in open-source systems,1
Inner Source in Platform-Based Product Engineering,13
"Input Domain Reduction through Irrelevant Variable Removal and Its Effect on Local, Global, and Hybrid Search-Based Structural Test Data Generation",66
Input-Sensitive Profiling,15
Insights from expert software design practice,42
Instance Generator and Problem Representation to Improve Object Oriented Code Coverage,46
IntEQ: recognizing benign integer overflows via equivalence checking across multiple precisions,5
Integer Linear Programming-Based Property Checking for Asynchronous Reactive Systems,5
Integer Parameter Synthesis for Real-Time Systems,50
Integrated impact analysis for managing software changes,124
Integrating adaptive user interface capabilities in enterprise applications,17
Integrating legacy systems with MDE,19
Integrating technical debt management and software quality management processes: a framework and field tests,4
Intelligent Code Completion with Bayesian Networks,27
Interacting process classes,14
Interaction Models and Automated Control under Partial Observable Environments,5
Interaction-based test-suite minimization,35
Interactive code review for systematic changes,40
"Interactive, Evolutionary Search in Upstream Object-Oriented Class Design",85
Interpolated n-grams for model based testing,27
Invariant-Based Automatic Testing of Modern Web Applications,133
Invariant-based automatic testing of AJAX user interfaces,243
Investigating Country Differences in Mobile App User Behavior and Challenges for Software Engineering,106
"Is ""better data"" better than ""better data miners""?: on the benefits of tuning SMOTE for defect prediction",33
Is operator-based mutant selection superior to random mutant selection?,96
Is spreadsheet ambiguity harmful? detecting and repairing spreadsheet smells due to ambiguous computation,30
Is the cure worse than the disease? overfitting in automated program repair,136
Is there a mismatch between real-world feature models and product-line research?,15
Is this class thread-safe? inferring documentation using graph-based learning,2
"It's not a bug, it's a feature: how misclassification impacts bug prediction",248
Iterative distribution-aware sampling for probabilistic symbolic execution,11
Iterative mining of resource-releasing specifications,23
J-Orchestra: Enhancing Java programs with distribution capabilities,59
JFlow: practical refactorings for flow-based parallelism,5
JITProf: pinpointing JIT-unfriendly JavaScript code,46
Jalangi: a selective record-replay and dynamic analysis framework for JavaScript,190
Join point interfaces for safe and flexible decoupling of aspects,45
Jumping through hoops: why do Java developers struggle with cryptography APIs?,68
KATCH: high-coverage testing of software patches,76
Keeping the Development Environment Up to Date—A Study of the Situated Practices of Appropriating the Eclipse IDE,8
Key factors for adopting inner source,47
Keyword Search for Building Service-Based Systems,11
Kmax: finding all configurations of Kbuild makefiles statically,6
LACE2: better privacy-preserving data sharing for cross project defect prediction,41
LAMP: data provenance for graph based machine learning algorithms through derivative computation,3
LASE: locating and applying systematic edits by learning from examples,131
LEAKPOINT: pinpointing the causes of memory leaks,78
Language Inclusion Checking of Timed Automata with Non-Zenoness,0
Language-Independent and Automated Software Composition: The FeatureHouse Experience,103
Large-scale analysis of framework-specific exceptions in Android apps,19
Large-scale study of substitutability in the presence of effects,0
Lattice-Based Sampling for Path Property Monitoring,2
Launch-mode-aware context-sensitive activity transition analysis,5
Learn&Fuzz: machine learning for input fuzzing,90
Learning API usages from bytecode: a statistical approach,22
Learning Assumptions for CompositionalVerification of Timed Systems,18
Learning Communicating Automata from MSCs,25
Learning Project Management Decisions: A Case Study with Case-Based Reasoning versus Data Farming,6
Learning Weighted Assumptions for Compositional Verification of Markov Decision Processes,6
Learning a Metric for Code Readability,187
Learning a dual-language vector space for domain-specific cross-lingual question retrieval,15
Learning combinatorial interaction test generation strategies using hyperheuristic search,69
Learning from examples to improve code completion systems,252
Learning operational requirements from goal models,88
Learning revised models for planning in adaptive systems,50
Learning syntactic program transformations from examples,67
Learning to log: helping developers make informed logging decisions,73
Learning to prioritize test programs for compiler testing,14
Learning to sample: exploiting similarities across environments to learn performance models for configurable systems,7
Less is More: Estimating Probabilistic Rewards over Partial System Explorations,4
Leveraging existing tests in automated test generation for web applications,53
Leveraging program analysis to reduce user-perceived latency in mobile applications,8
Leveraging program equivalence for adaptive program repair: models and first results,167
Leveraging syntax-related code for automated program repair,42
Leveraging test generation and specification mining for automated bug detection without false positives,57
Liability in software engineering: overview of the LISE approach and illustration on a case study,20
LibD: scalable and precise third-party library detection in android markets,43
License integration patterns: Addressing license mismatches in component-based development,113
Lifting model transformations to product lines,39
Lightweight adaptive filtering for efficient learning and updating of probabilistic models,35
Lightweight fault-localization using multiple coverage types,284
"Lightweight, Obfuscation-Resilient Detection and Family Identification of Android Malware",22
Linear Programming as a Baseline for Software Effort Estimation,7
Linear and Branching System Metrics,77
Linking Model-Driven Development and Software Architecture: A Case Study,69
Linking e-mails and source code artifacts,150
Listening to programmers Taxonomies and characteristics of comments in operating system code,47
Live API documentation,150
Local versus Global Lessons for Defect Prediction and Effort Estimation,160
Local vs. global models for effort estimation and defect prediction,124
Local-based active classification of test report to assist crowdsourced testing,25
Localization of concurrency bugs using shared memory access pairs,10
Localizing SQL faults in database applications,29
Locating Need-to-Externalize Constant Strings for Software Internationalization with Generalized String-Taint Analysis,5
Locating Software Faults Based on Minimum Debugging Frontier Set,5
Locating need-to-translate constant strings for software internationalization,18
LockPeeker: detecting latent locks in Java APIs,5
Locking discipline inference and checking,9
Locus: locating bugs from software changes,35
Loopster: static loop termination analysis,1
Loupe: Verifying Publish-Subscribe Architectures with a Magnifying Lens,15
MADMatch: Many-to-Many Approximate Diagram Matching for Design Comparison,23
MAHAKIL: Diversity Based Oversampling Approach to Alleviate the Class Imbalance Issue in Software Defect Prediction,43
MIMIC: locating and understanding bugs by analyzing mimicked executions,21
MINTS: A general framework and tool for supporting test-suite minimization,99
MODE: automated neural network model debugging via state differential analysis and input selection,3
MOSES: A Framework for QoS Driven Runtime Adaptation of Service-Oriented Systems,171
MSeer: an advanced technique for locating multiple bugs in parallel,7
MSeqGen: object-oriented unit-test generation via mining source code,92
Machine learning-based detection of open source license exceptions,10
Machine-learning-guided selectively unsound static analysis,14
MagicFuzzer: scalable deadlock detection for large-scale applications,68
Maintaining Architecture-Implementation Conformance to Support Architecture Centrality: From Single System to Product Line Development,4
Maintaining and evolving GUI-directed test scripts,171
Maintaining invariant traceability through bidirectional transformations,46
Making CEGAR More Efficient in Software Model Checking,17
Making malory behave maliciously: targeted fuzzing of android execution environments,26
Making offline analyses continuous,20
Making system user interactive tests repeatable: when and what should we control?,19
Making web applications more energy efficient for OLED smartphones,93
Managing Technical Debt in Enterprise Software Packages,24
Managing non-functional uncertainty via model-driven adaptivity,85
Manual refactoring changes with automated refactoring validation,43
Many-Objective Software Remodularization Using NSGA-III,96
"Mapping Bug Reports to Relevant Files: A Ranking Model, a Fine-Grained Benchmark, and Feature Evaluation",24
Marple: Detecting faults in path segments using automatically generated analyses,4
Matching and Merging of Variant Feature Specifications,32
Matching dependence-related queries in the system dependence graph,44
Maturing Software Engineering Knowledge through Classifications: A Case Study on Unit Testing Techniques,37
Measure it? Manage it? Ignore it? software practitioners and technical debt,96
Measuring Code Quality to Improve Specification Mining,39
Measuring Program Comprehension: A Large-Scale Field Study with Professionals,18
"Measuring complexity, effectiveness and efficiency in software course projects",14
Measuring neural efficiency of program comprehension,22
Measuring program comprehension: a large-scale field study with professionals,18
Measuring software redundancy,21
Measuring the Discriminative Power of Object-Oriented Class Cohesion Metrics,65
Measuring the Impact of Code Dependencies on Software Architecture Recovery Techniques,14
Measuring the cost of regression testing in practice: a study of Java projects using continuous integration,25
Measuring the strength of information flows in programs,44
Measuring the structural complexity of feature models,25
MemFix: static analysis-based repair of memory deallocation errors for C,3
MemInsight: platform-independent memory debugging for JavaScript,20
Metadata invariants: checking and inferring metadata coding conventions,15
Metamorphic Testing for Software Quality Assessment: A Study of Search Engines,53
Metamorphic Testing of RESTful Web APIs,11
Metamorphic model-based testing applied on NASA DAT: an experience report,37
Method and developer characteristics for effective agile method tailoring: A study of XP expert opinion,122
Methodbook: Recommending Move Method Refactorings via Relational Topic Models,95
MiL testing of highly configurable continuous controllers: scalable search using surrogate models,12
Micro execution,38
Migrating cascading style sheets to preprocessors by introducing mixins,9
Mimic: computing models for opaque code,19
Mind the gap: assessing the conformance of software traceability to relevant guidelines,51
Minimizing CPU time shortage risks in integrated embedded software,5
Mining API mapping for language migration,113
Mining Crosscutting Concerns through Random Walks,13
Mining Privacy Goals from Privacy Policies Using Hybridized Task Recomposition,16
Mining SQL injection and cross site scripting vulnerabilities using hybrid program analysis,76
Mining Semantic Loop Idioms,6
Mining Sequences of Developer Interactions in Visual Studio for Usage Smells,17
Mining Unit Tests for Discovery and Migration of Math APIs,4
Mining Version Histories for Detecting Code Smells,123
Mining Workflow Models from Web Applications,7
Mining apps for abnormal usage of sensitive data,155
Mining behavior models from enterprise web applications,49
Mining behavior models from user-intensive web applications,68
Mining billions of AST nodes to study actual and potential usage of Java language features,66
Mining branching-time scenarios,32
Mining configuration constraints: static analyses and empirical results,104
Mining exception-handling rules as sequence association rules,111
Mining file histories: should we consider branches?,4
Mining fine-grained code changes to detect unknown change patterns,73
Mining implicit design templates for actionable code reuse,5
"Mining interprocedural, data-oriented usage patterns in JavaScript web applications",16
Mining sandboxes,28
Mining succinct predicated bug signatures,21
MintHint: automated synthesis of repair hints,70
Missing data imputation based on low-rank recovery and semi-supervised regression for software effort estimation,7
MobiPlay: a remote execution based record-and-replay tool for mobile applications,37
Model Checking Probabilistic and Stochastic Extensions of the π-Calculus,32
Model Checking Semantically Annotated Services,40
Model Checking Software with First Order Logic Specifications Using AIG Solvers,2
Model Checking Timed and Stochastic Properties with CSL^{TA},98
Model Transformation Modularization as a Many-Objective Optimization Problem,21
Model based test validation and oracles for data acquisition systems,10
Model checking distributed systems by combining caching and process checkpointing,12
Model checking lots of systems: efficient verification of temporal properties in software product lines,308
Model evolution by run-time parameter adaptation,276
"Model transformation languages under a magnifying glass: a controlled experiment with Xtend, ATL, and QVT",1
Model-Based Self-Aware Performance and Resource Management Using the Descartes Modeling Language,38
Model-Based Test Oracle Generation for Automated Unit Testing of Agent Systems,53
Model-Transformation Design Patterns,48
Model-based synthesis of control software from system-level formal specifications,22
Model-based whitebox fuzzing for program binaries,44
Model-driven run-time enforcement of complex role-based access control policies,1
"Model-level, platform-independent debugging in the context of the model-driven development of real-time systems",12
Modeling Human-in-the-Loop Security Analysis and Decision-Making Processes,7
Modeling Product Line Software Assets Using Domain-Specific Kits,14
Modeling and verification of evolving cyber-physical spaces,15
Modeling and verifying hierarchical real-time systems using stateful timed CSP,66
Modeling readability to improve unit tests,46
"Modify, enhance, select: co-evolution of combinatorial models and test plans",1
Modular Software Model Checking for Distributed Systems,26
Modular aspect-oriented design with XPIs,56
Modular string-sensitive permission analysis with demand-driven precision,37
Modular verification of interrupt-driven software,6
Monitor-Based Instant Software Refactoring,35
Monitoring Data Usage in Distributed Systems,19
Monitoring probabilistic properties,43
More accurate recommendations for method-level changes,2
More effective interpolations in software model checking,3
Morpheus: variability-aware refactoring in the wild,34
Move-optimized source code tree differencing,20
Moving into a new software project landscape,115
Multi-Criteria Code Refactoring Using Search-Based Software Engineering: An Industrial Case Study,38
Multi-Objective Optimization of Energy Consumption of GUIs in Android Apps,2
Multi-Objective Quality-Driven Service Selection—A Fully Polynomial Time Approximation Scheme,38
Multi-Step Learning and Adaptive Search for Learning Complex Model Transformations from Examples,15
Multi-granular conflict and dependency analysis in software engineering based on graph transformation,6
Multi-objective integer programming approaches for solving optimal feature selection problem: a new perspective on multi-objective optimization problems in SBSE,0
Multi-objective optimization in rule-based design space exploration,43
Multi-objective software effort estimation,71
Multi-objective test report prioritization using image understanding,23
MultiSE: multi-path symbolic execution using value summaries,69
Mutable Protection Domains: Adapting System Fault Isolation for Reliability and Efficiency,10
Mutation Operators for Spreadsheets,73
Mutation-Driven Generation of Unit Tests and Oracles,330
N-way model merging,46
NAR-miner: discovering negative association rules from code for bug detection,0
NLP-KAOS for Systems Goal Elicitation: Smart Metering System Case Study,23
Name-Based Analysis of Equally Typed Method Arguments,5
Navigating the maze: the impact of configurability in bioinformatics software,4
NeedFeed: taming change notifications by modeling code relevance,15
Nemo: multi-criteria test-suite minimization with integer nonlinear programming,3
Neural-augmented static analysis of Android communication,2
Neural-machine-translation-based commit message generation: how far are we?,8
Neuro-symbolic program corrector for introductory programming assignments,9
"No PAIN, no gain?: the utility of PArallel fault INjections",23
NoFAQ: synthesizing command repairs from examples,8
Noise and heterogeneity in historical build data: an empirical study of Travis CI,5
Nomen est omen: exploring and exploiting similarities between argument and parameter names,15
Nopol: Automatic Repair of Conditional Statement Bugs in Java Programs,140
Not going to take this anymore: multi-objective overtime planning for software engineering projects,61
O2O service composition with social collaboration,2
OASIS: prioritizing static analysis warnings for Android apps based on app user reviews,5
OBEY: Optimal Batched Refactoring Plan Execution for Class Responsibility Redistribution,6
Object-centric debugging,62
Observable modified Condition/Decision coverage,40
On Accelerating Source Code Analysis at Massive Scale,2
On Event-Based Middleware for Location-Aware Mobile Applications,34
On Fault Representativeness of Software Fault Injection,150
On adopting linters to deal with performance concerns in Android apps,2
On cross-stack configuration errors,11
On essential configuration complexity: measuring interactions in highly-configurable systems,58
On evidence preservation requirements for forensic-ready systems,1
On software component co-installability,31
