Title,Citation
"On the ""naturalness"" of buggy code",89
"On the Accuracy, Efficiency, and Reusability of Automated Test Oracles for Android Devices",40
On the Asymptotic Behavior of Adaptive Testing Strategy for Software Reliability Assessment,23
On the Composability of Design Patterns,10
On the Comprehension of Program Comprehension,98
On the Distribution of Bugs in the Eclipse System,47
On the Effectiveness of Contracts as Test Oracles in the Detection and Diagnosis of Functional Faults in Concurrent Object-Oriented Software,9
On the Evolution of Services,115
On the Positive Effect of Reactive Programming on Software Comprehension: An Empirical Study,14
On the Semantics of Distributed Reactive Programming: The Cost of Consistency,9
On the Use of Hidden Markov Model to Predict the Time to Fix Bugs,4
On the Value of Ensemble Effort Estimation,187
On the analysis of evolution of software artefacts and programs,1
On the dichotomy of debugging behavior among programmers,10
On the impact of UML analysis models on source-code comprehensibility and modifiability,31
On the limits of mutation reduction strategies,27
On the naturalness of software,405
On the relationship between process maturity and geographic distribution: an empirical analysis of their impact on software quality,50
On the scalability of Linux kernel maintainers' work,3
"On the techniques we create, the tools we build, and their misalignments: a study of KLEE",11
On the use of delta debugging to reduce recordings and facilitate debugging of web applications,19
On the use of hidden Markov model to predict the time to fix bugs,4
On the value of user preferences in search-based software engineering: a case study in software product lines,187
On-demand test suite reduction,68
One size does not fit all: an empirical study of containerized continuous deployment workflows,1
Online Reliability Prediction via Motifs-Based Dynamic Bayesian Networks for Service-Oriented Systems,13
Online app review analysis for identifying emerging issues,11
Online inference and enforcement of temporal properties,101
"Open source barriers to entry, revisited: a sociotechnical perspective",22
Open source-style collaborative development practices in commercial projects using GitHub,49
Operator-based and random mutant selection: better together,56
Optimized Resource Allocation for Software Release Planning,58
Optimizing Ordered Throughput Using Autonomic Cloud Bursting Schedulers,26
Optimizing customized program coverage,11
Optimizing energy consumption of GUIs in Android apps: a multi-objective approach,62
Optimizing selection of competing services with probabilistic hierarchical refinement,13
Optimizing test placement for module-level regression testing,11
Optimizing test prioritization via test distribution analysis,1
Oracle-guided component-based program synthesis,327
Oracles for Distributed Testing,33
Oracles for Testing Software Timeliness with Uncertainty,0
Oreo: detection of clones in the twilight zone,13
Organizing self-organizing teams,119
Overcoming open source project entry barriers with a portal for newcomers,49
Overcoming the challenges in cost estimation for distributed software projects,33
P3: partitioned path profiling,5
PAC learning-based verification and model synthesis,11
PARTI: a multi-interval theory solver for symbolic execution,1
PATDroid: permission-aware GUI testing of Android,15
PEoPL: projectional editing of product lines,10
PFix: fixing concurrency bugs based on memory access patterns,1
PIEtrace: platform independent executable trace,4
PLASMA: a plan-based layered architecture for software model-driven adaptation,86
PRADA: prioritizing android devices for apps by mining large-scale usage data,29
PaMpeR: proof method recommendation system for Isabelle/HOL,4
"Pair Programming and Software Defects--A Large, Industrial Case Study",63
Palantir: Early Detection of Development Conflicts Arising from Parallel Code Changes,89
Parallel Algorithms for Generating Distinguishing Sequences for Observable Non-deterministic FSMs,6
Parallel Algorithms for Testing Finite State Machines:Generating UIO Sequences,13
Parallel Performance Problems on Shared-Memory Multicore Systems: Taxonomy and Observation,6
Parallel bug-finding in concurrent programs via reduced interleaving instances,6
Parameterized model counting for string and numeric constraints,1
Parsimony: an IDE for example-guided synthesis of lexers and parsers,2
Partial constraint checking for context consistency in pervasive computing,73
Partial evaluation of model transformations,16
Partial models: towards modeling and reasoning with uncertainty,113
Partition-based regression verification,42
Patch verification via multiversion interprocedural control flow graphs,21
Path exploration based on symbolic output,45
Path sensitive static analysis of web applications for remote code execution vulnerability detection,50
Path- and index-sensitive string analysis based on monadic second-order logic,69
Path-based function embedding and its application to error-handling specification mining,6
Patterns of Knowledge in API Reference Documentation,82
"Peer Review on Open-Source Software Projects: Parameters, Statistical Models, and Theory",52
PerLa: A Language and Middleware Architecture for Data Management and Integration in Pervasive Information Systems,64
Perceived language complexity in GitHub issue discussions and their effect on issue resolution,9
PerfLearner: learning from bug reports to understand and generate performance test frames,1
Performance Specification and Evaluation with Unified Stochastic Probes and Fluid Analysis,32
Performance comprehension at WiredTiger,0
Performance debugging in the large via mining millions of stack traces,144
Performance diagnosis for inefficient loops,14
Performance issues and optimizations in JavaScript: an empirical study,38
Performance regression testing target prioritization via performance risk analysis,37
Performance-influence models for highly configurable systems,103
Perses: syntax-guided program reduction,7
Personalized Reliability Prediction of Web Services,78
Personalized defect prediction,122
Pert: The Application-Aware Tailoring of Java Object Persistence,4
Perturbation analysis of stochastic systems with empirical distribution parameters,13
Phys: probabilistic physical unit assignment and inconsistency detection,0
Plat_Forms: A Web Development Platform Comparison by an Exploratory Experiment Searching for Emergent Platform Properties,28
Platys: An Active Learning Framework for Place-Aware Application Development and Its Evaluation,24
Pointcut Rejuvenation: Recovering Pointcut Expressions in Evolving Aspect-Oriented Software,26
PorchLight: a tag-based approach to bug triaging,25
Portfolio: Searching for relevant functions and their usages in millions of lines of code,54
Potential biases in bug localization: do they matter?,32
Power-Law Distributions of Component Size in General Software Systems,34
PrIMe: A methodology for developing provenance-aware applications,76
Practical Combinatorial Interaction Testing: Empirical Findings on Efficiency and Early Fault Detection,47
Practical fault localization for dynamic web applications,91
Practical guidelines for change recommendation using association rule mining,12
Practical isolation of failure-inducing changes for debugging regression faults,22
Practical static analysis of JavaScript applications in the presence of frameworks and libraries,101
Precise Calling Context Encoding,60
Precise concolic unit testing of C programs using extended units and symbolic alarm filtering,6
Precise condition synthesis for program repair,91
Precise memory leak detection for java software using container profiling,13
Precise semantic history slicing through dynamic delta refinement,8
Precision reuse for efficient regression verification,36
Precomputing possible configuration error diagnoses,73
Predicting Consistency-Maintenance Requirement of Code Clonesat Copy-and-Paste Time,8
Predicting Delivery Capability in Iterative Software Development,10
Predicting Future Developer Behavior in the IDE Using Topic Models,5
Predicting Node failure in cloud service systems,2
Predicting Project Velocity in XP Using a Learning Dynamic Bayesian Network Model,69
Predicting Query Quality for Applications of Text Retrieval to Software Engineering Tasks,13
Predicting Vulnerable Software Components via Text Mining,122
Predicting build failures using social network analysis on developer communication,204
Predicting faults using the complexity of code changes,485
Predicting performance via automated feature-interaction detection,154
Predicting recurring crash stacks,30
Predicting relevance of change recommendations,4
Predicting semantically linkable knowledge in developer online forums via convolutional neural network,57
Prediction of atomic web services reliability based on k-means clustering,38
PrefFinder: getting the right preference in configurable software systems,20
Presence-condition simplification in highly configurable systems,27
Prevalence of coincidental correctness and mitigation of its impact on fault localization,50
Preventing Defects: The Impact of Requirements Traceability Completeness on Software Quality,25
Preventing Temporal Violations in Scientific Workflows: Where and How,58
Preventing database deadlocks in applications,17
Prioritizing browser environments for web application test execution,0
Prioritizing tests for fault localization through ambiguity group reduction,56
Privacy and utility for defect prediction: experiments with MORPH,42
Privacy preserving via interval covering based subclass division and manifold learning based bi-directional obfuscation for effort estimation,4
ProEva: runtime proactive performance evaluation based on continuous-time markov chains,6
"Proactive Self-Adaptation for Improving the Reliability of Mission-Critical, Embedded, and Mobile Software",17
Proactive and Reactive Runtime Service Discovery: A Framework and Its Evaluation,34
Proactive self-adaptation under uncertainty: a probabilistic model checking approach,87
Probabilistic Interface Automata,0
Probabilistic Model Checking of Regenerative Concurrent Systems,20
Probabilistic environments in the quantitative analysis of (non-probabilistic) behaviour models,11
Probabilistic model checking of perturbed MDPs with applications to cloud computing,3
Probing for requirements knowledge to stimulate architectural thinking,5
Process Aspects and Social Dynamics of Contemporary Code Review: Insights from Open Source Development and Industrial Practice at Microsoft,22
Program Behavior Discovery and Verification: A Graph Grammar Approach,34
Program Characterization Using Runtime Values and Its Application to Software Plagiarism Detection,22
Program analysis for secure big data processing,17
Program splicing,3
Program synthesis using natural language,33
Program transformations to fix C integers,57
Programmer-Friendly Refactoring Errors,17
Programmers' build errors: a case study (at google),85
Programming not only by example,0
Programming pervasive and mobile computing applications: The TOTA approach,212
Promoting secondary orders of event pairs in randomized scheduling using a randomized stride,1
Proofs from Tests,179
Propagating configuration decisions with modal implication graphs,5
Property differencing for incremental checking,30
Prove it! Inferring Formal Proof Scripts from CafeOBJ Proof Scores,0
Providing Architectural Languages and Tools Interoperability through Model Transformation Technologies,105
Proving MCAPI executions are correct using SMT,8
Putback-based bidirectional model transformations,0
Putting Preemptive Time Petri Nets to Work in a V-Model SW Life Cycle,17
Puzzle-based automatic testing: bringing humans into the loop by solving puzzles,39
QTEP: quality-aware test case prioritization,19
QVM: An Efficient Runtime for Detecting Defects in Deployed Systems,30
QoS Assurance for Dynamic Reconfiguration of Component-Based Software Systems,32
Qos-driven runtime adaptation of service oriented architectures,141
Quality Requirements in Industrial Practice—An Extended Interview Study at Eleven Companies,67
Quality and productivity outcomes relating to continuous integration in GitHub,141
Quality experience: a grounded theory of successful agile projects without dedicated testers,12
Quality of service profiling,219
Quality-Aware Service Selection for Service-Based Systems Based on Iterative Multi-Attribute Combinatorial Auction,71
Quantifying and mitigating turnover-induced knowledge loss: case studies of chrome and a project at avaya,25
Quantifying developers' adoption of security tools,34
Quantifying the Effect of Code Smells on Maintenance Effort,211
Quantitative Evaluation of Model-Driven Performance Analysis and Simulation of Component-Based Architectures,61
Query quality prediction and reformulation for source code search: the refoqus tool,14
Query-based configuration of text retrieval solutions for software engineering tasks,24
Questions developers ask while diagnosing potential security vulnerabilities with static analysis,35
RADAR: a lightweight tool for requirements and architecture decision analysis,13
RClassify: classifying race conditions in web applications via deterministic replay,8
RECONTEST: effective regression testing of concurrent programs,25
RELAI Testing: A Technique to Assess and Improve Software Reliability,12
REPENT: Analyzing the Nature of Identifier Renamings,37
RERAN: timing- and touch-sensitive record and replay for Android,263
RESISTing reliability degradation through proactive reconfiguration,31
RESTful API Automated Test Case Generation with EvoMaster,3
RETracer: triaging crashes by reverse execution from partial memory dumps,28
RFC-directed differential testing of certificate validation in SSL/TLS implementations,2
Radius aware probabilistic testing of deadlocks with guarantees,3
Random Testing: Theoretical Results and Practical Implications,134
Range Fixes: Interactive Error Resolution for Software Configuration,22
Ranger: parallel analysis of alloy models by range partitioning,14
Ranking and Clustering Software Cost Estimation Models through a Multiple Comparisons Algorithm,109
Rate-Based Queueing Simulation Model of Open Source Software Debugging Activities,11
ReCBuLC: reproducing concurrency bugs using local clocks,11
ReScue: crafting regular expression DoS attacks,3
Reasoning About Identifier Spaces: How to Make Chord Correct,7
Reasoning about edits to feature models,355
"Reasoning about the Reliability of Diverse Two-Channel Systems in Which One Channel Is ""Possibly Perfect""",39
Recommending Adaptive Changes for Framework Evolution,199
Recommending Who to Follow in the Software Engineering Twitter Space,2
Recommending and localizing change requests for mobile apps based on user reviews,48
Recommending relevant classes for bug reports using multi-objective search,16
Recommending source code for use in rapid software prototypes,55
Recomputing Coverage Information to Assist Regression Testing,63
Reconciling manual and automatic refactoring,90
"Recovering clear, natural identifiers from obfuscated JS names",21
Recovering traceability links between an API and its learning resources,108
Recurring bug fixes in object-oriented programs,118
Redefining prioritization: continuous prioritization for continuous integration,8
Reducer-based construction of conditional verifiers,5
Reducing Features to Improve Code Change-Based Bug Prediction,154
Reducing Masking Effects in CombinatorialInteraction Testing: A Feedback DrivenAdaptive Approach,24
Reducing Unauthorized Modification of Digital Objects,8
Reducing combinatorics in GUI testing of android applications,54
Reducing confounding bias in predicate-level statistical debugging metrics,35
Reducing interactive refactoring effort via clustering-based multi-objective search,1
Reducing the effort of bug report triage: Recommenders for development-oriented decisions,208
Refactoring Inspection Support for Manual Refactoring Edits,3
Refactoring Multi-Level Models,2
Refactoring for reentrancy,77
Refactoring sequential Java code for concurrency via concurrent libraries,145
"Reference hijacking: patching, protecting and analyzing on unmodified and non-rooted android devices",20
RefiNym: using names to refine types,1
Regression test selection across JVM boundaries,13
Regression tests to expose change interaction errors,35
Regular property guided dynamic symbolic execution,21
Release planning of mobile apps based on user reviews,99
Reliability analysis in symbolic pathfinder,86
Reliability of Run-Time Quality-of-Service evaluation using parametric model checking,17
Renaming and shifted code in structured merging: looking ahead for precision and performance,5
Repairing crashes in Android apps,9
Repairing event race errors by controlling nondeterminism,18
Replay without recording of production bugs for service oriented applications,2
Replicating and Re-Evaluating the Theory of Relative Defect-Proneness,13
Reproducing concurrency failures from crash stacks,10
Required behavior of sequence diagrams: Semantics and conformance,9
Requirements Elicitation and Specification Using the Agent Paradigm: The Case Study of an Aircraft Turnaround Simulator,37
Requirements fixation,36
Requirements modelling by synthesis of deontic input-output automata,21
Researcher Bias: The Use of Machine Learning in Software Defect Prediction,184
Residual Investigation: Predictive and Precise Bug Detection,15
"Resource Management for Complex, Dynamic Environments",28
Responsive designs in a snap,8
Reuse-oriented reverse engineering of functional components from x86 binaries,15
Reverb: recommending code-related web pages,38
Reviser: efficiently updating IDE-/IFDS-based data-flow analyses in response to incremental program changes,27
Revisit of automatic debugging via human focus-tracking analysis,24
Revisiting code ownership and its relationship with software quality in the scope of modern code review,44
Revisiting the Performance Evaluation of Automated Approaches for the Retrieval of Duplicate Issue Reports,9
Revisiting the impact of classification techniques on the performance of defect prediction models,166
Revisiting unsupervised learning for defect prediction,25
Reviving Sequential Program Birthmarking for Multithreaded Software Plagiarism Detection,7
Risk-driven revision of requirements models,6
Robust reconfigurations of component assemblies,47
Roles and impacts of hands-on software architects in five industrial case studies,0
Round-up: runtime checking quasi linearizability of concurrent data structures,12
Rule-based extraction of goal-use case models from text,8
Runtime Fault Detection in Programmed Molecular Systems,3
Runtime Verification for LTL and TLTL,441
Runtime monitoring of software energy hotspots,42
S3: syntax- and semantic-guided repair synthesis via programming by examples,75
SABRINE: state-based robustness testing of operating systems,16
SEDGE: symbolic example data generation for dataflow programs,11
SEEDE: simultaneous execution and editing in a development environment,0
SEEDS: a software engineer's energy-optimization decision support framework,126
SIP: Optimal Product Selection from Feature Models Using Many-Objective Evolutionary Optimization,50
SITAR: GUI Test Script Repair,28
SMT-Based Bounded Model Checking for Embedded ANSI-C Software,250
SOFIA: an automated security oracle for black-box testing of SQL-injection vulnerabilities,11
SPAIN: security patch analysis for binaries towards understanding the pain and pills,12
SPLat: lightweight dynamic analysis for reducing combinatorics in testing configurable systems,51
STADS: Software Testing as Species Discovery,3
STAR: Stack Trace Based Automatic Crash Reproduction via Symbolic Execution,29
SWIM: synthesizing what i mean: code search and idiomatic snippet synthesis,55
Safe asynchronous multicore memory operations,2
Safe memory-leak fixing for C programs,55
Safe software updates via multi-version execution,72
Safe stream-based programming with refinement types,2
Safe-commit analysis to facilitate team software development,57
Safer User Interfaces: A Case Study in Improving Number Entry,22
Sample size vs. bias in defect prediction,68
Saturation-based testing of concurrent programs,30
Scalability-first pointer analysis with self-tuning context-sensitivity,5
Scalable Differential Analysis of Process Algebra Models,120
Scalable Runtime Bloat Detection Using Abstract Dynamic Slicing,17
Scalable analysis of variable software,132
Scalable and Effective Test Generation for Role-Based Access Control Systems,42
Scalable and incremental software bug detection,24
Scalable and precise symbolic analysis for atomicity violations,13
Scalable incremental building with dynamic task dependencies,0
Scalable product line configuration: a straw to break the camel's back,117
Scalable thread sharing analysis,8
Scaling Up Symbolic Analysis by Removing Z-Equivalent States,5
Scaling exact multi-objective combinatorial optimization by parallelization,38
Scaling predictive analysis of concurrent programs by removing trace redundancy,20
Scaling up automated test generation: Automatically generating maintainable regression unit tests for programs,46
Schedule of Bad Smell Detection and Resolution: A New Way to Save Effort,95
Scheduling constraint based abstraction refinement for weak memory models,0
Search-based genetic optimization for deployment and reconfiguration of software in the cloud,122
Search-based inference of polynomial metamorphic relations,32
Search-based test data generation for SQL queries,2
Search-carrying code,5
Search-driven string constraint solving for vulnerability detection,16
Searching for better configurations: a rigorous approach to clone evaluation,126
Second-order constraints in dynamic invariant inference,7
Secure coding practices in Java: challenges and vulnerabilities,15
Security-driven model-based dynamic adaptation,42
Seer: A Lightweight Online Failure Prediction Approach,10
Segmented symbolic analysis,18
Self-Adapting Reliability in Distributed Software Systems,19
Self-Adaptive and Online QoS Modeling for Cloud-Based Software Services,18
Self-Management of Adaptable Component-Based Applications,33
Self-Organizing Roles on Agile Software Development Teams,158
Self-Supervising BPEL Processes,137
Self-adaptation through incremental generative model transformations at runtime,39
Self-adaptive software meets control theory: A preliminary approach supporting reliability requirements,80
Self-hiding behavior in Android apps: detection and characterization,1
Self-protection of Android systems from inter-component communication attacks,0
SemFix: program repair via semantic analysis,357
Semantic Slicing of Software Version Histories,22
Semantic crash bucketing,6
Semantic program repair using a reference implementation,18
Semantic self-assessment of query results in dynamic environments,15
Semantically enhanced software traceability using deep learning techniques,43
Semantics-assisted code review: an efficient toolchain and a user study,4
Semantics-based code search,270
"Semi-Proving: An Integrated Method for Program Proving, Testing, and Debugging",59
Semi-automatically extracting FAQs to improve accessibility of software development knowledge,47
Sentiment analysis for software engineering: how far can we go?,23
Server interface descriptions for automated testing of JavaScript web applications,10
Service-Level Agreements for Electronic Services,69
Session Reliability of Web Systems under Heavy-Tailed Workloads: An Approach Based on Design and Analysis of Experiments,10
Shadow Symbolic Execution for Testing Software Patches,1
Shadow of a doubt: testing for divergences between software versions,21
SimRT: an automated framework to support regression testing for data races,36
SimplyDroid: efficient event sequence simplification for Android application,4
Simulation-based abstractions for software product-line model checking,60
Singularity: pattern fuzzing for worst case complexity,3
Sireum/Topi LDP: a lightweight semi-decision procedure for optimizing symbolic execution-based analyses,18
Size-Constrained Regression Test Case Selection Using Multicriteria Optimization,64
Slicing MATLAB simulink models,59
Software Change Contracts,8
"Software Dependencies, Work Dependencies, and Their Impact on Failures",259
Software Development Estimation Biases: The Role of Interdependence,36
Software Development in Startup Companies: The Greenfield Startup Model,78
Software Module Clustering as a Multi-Objective Search Problem,269
Software Numerical Instability Detection and Diagnosis by Combining Stochastic and Infinite-Precision Testing,4
Software Plagiarism Detection with Birthmarks Based on Dynamic Key Instruction Sequences,29
Software Reliability Analysis Using Weakest Preconditions in Linear Assignment Programs,2
Software Reliability Modeling with Software Metrics Data via Gaussian Processes,13
Software Reliability and Testing Time Allocation: An Architecture-Based Approach,87
Software analytics for incident management of online services: an experience report,31
Software change dynamics: evidence from 35 java projects,15
Software design sketching with calico,55
Software development waste,35
Software effort estimation as a multiobjective learning problem,73
Software engineering abstractions for the multi-touch revolution,11
Software engineering at the speed of light: how developers stay current using twitter,79
"Software model checking for distributed systems with selector-based, non-blocking communication",18
Software performance self-adaptation through efficient model predictive control,5
Software process evaluation: A machine learning approach,17
Software protection on the go: a large-scale empirical study on mobile app obfuscation,6
Software traceability with topic modeling,285
Solving string constraints lazily,55
